{
  "fixtureVersion": 1,
  "id": "frontend-hello",
  "layer": "frontend",
  "projectFile": "hello.project.json",
  "manifestLockFile": "../../compiler-manifests/turbowarp-server.lock.json",
  "expectedIrFile": "hello.expected.ir.json",
  "externalVectors": [
    {
      "packageName": "@kubohiroya/turbowarp-asset-cache",
      "packageVersion": "0.1.0",
      "integrity": "sha256-StI16Se8kQtTj3Ev7uIDedIupGLWDQhhrBIzCmCEOQM="
    },
    {
      "packageName": "@kubohiroya/turbowarp-kvs",
      "packageVersion": "0.1.0",
      "integrity": "sha256-J5lrwrYlhftOXRE9bwaGvKzBtxYtRy5kYujV68tz39Q="
    },
    {
      "packageName": "@kubohiroya/turbowarp-structured-data",
      "packageVersion": "0.11.0-rc.1",
      "integrity": "sha256-HQLxeHKHXs74OsGEZjcQGdRfeFAqTg6vK+Io6a6Cp6E="
    }
  ]
}
